arcface_mtcnn/build/nohup.out
UNKNOWN: *************** Autotuning format combination: Float(1,384,82944,248832) -> Float(1,382,81748,817480) ***************
UNKNOWN: conv1 (scudnn) Set Tactic Name: volta_scudnn_128x128_relu_interior_nn_v1
UNKNOWN: conv1 (scudnn) Set Tactic Name: volta_scudnn_128x128_relu_medium_nn_v1
UNKNOWN: conv1 (scudnn) Set Tactic Name: volta_scudnn_128x32_relu_interior_nn_v1
UNKNOWN: conv1 (scudnn_winograd) Set Tactic Name: volta_scudnn_winograd_128x128_ldg1_ldg4_relu_tile148t_nt_v1
UNKNOWN: conv1 (scudnn) Set Tactic Name: volta_scudnn_128x64_relu_xregs_large_nn_v1
UNKNOWN: conv1 (scudnn) Set Tactic Name: volta_scudnn_128x128_relu_small_nn_v1
UNKNOWN: conv1 (scudnn) Set Tactic Name: volta_scudnn_128x128_relu_xregs_large_nn_v1
UNKNOWN: conv1 (scudnn) Set Tactic Name: volta_scudnn_128x64_relu_small_nn_v1
UNKNOWN: conv1 (scudnn) Set Tactic Name: volta_scudnn_128x64_relu_interior_nn_v1
UNKNOWN: conv1 (scudnn) Set Tactic Name: volta_scudnn_128x64_relu_medium_nn_v1
UNKNOWN: conv1 (scudnn) Set Tactic Name: volta_scudnn_128x32_relu_medium_nn_v1
UNKNOWN: conv1 (scudnn) Set Tactic Name: volta_scudnn_128x32_relu_small_nn_v1
UNKNOWN: --------------- Timing Runner: conv1 (FusedConvActConvolution)
UNKNOWN: Tactic: 524287 time 1.89853
UNKNOWN: Tactic: 1966079 time 1.99882
UNKNOWN: Tactic: 2031615 time 1.9641
UNKNOWN: Tactic: 4390911 time 2.07158
UNKNOWN: Tactic: 5963775 time 2.01827
UNKNOWN: Tactic: 6881279 time 2.05619
UNKNOWN: Tactic: 8585215 time 1.88013
UNKNOWN: Tactic: 8978431 time 1.46531
UNKNOWN: Tactic: 9502719 time 1.52582
UNKNOWN: Tactic: 10092543 time 1.56275
UNKNOWN: Tactic: 10289151 time 1.49613
UNKNOWN: Fastest Tactic: 8978431 Time: 1.46531
UNKNOWN: --------------- Timing Runner: conv1 (CaskConvolution)
UNKNOWN: conv1 (scudnn) Set Tactic Name: volta_scudnn_128x128_relu_interior_nn_v1
UNKNOWN: Tactic: 1754569683116234317 time 2.95421
UNKNOWN: conv1 (scudnn) Set Tactic Name: volta_scudnn_128x128_relu_medium_nn_v1
UNKNOWN: Tactic: 1825138533642645384 time 3.03104
UNKNOWN: conv1 (scudnn) Set Tactic Name: volta_scudnn_128x32_relu_interior_nn_v1
UNKNOWN: Tactic: 2733356012094739613 time 0.722944
UNKNOWN: conv1 (scudnn_winograd) Set Tactic Name: volta_scudnn_winograd_128x128_ldg1_ldg4_relu_tile148t_nt_v1
UNKNOWN: Tactic: 2775507031594384867 time 1.37216
UNKNOWN: conv1 (scudnn) Set Tactic Name: volta_scudnn_128x64_relu_xregs_large_nn_v1
UNKNOWN: Tactic: 2842488832350522458 time 1.65155
UNKNOWN: conv1 (scudnn) Set Tactic Name: volta_scudnn_128x128_relu_small_nn_v1
UNKNOWN: Tactic: 3915320020053085238 time 3.02262
UNKNOWN: conv1 (scudnn) Set Tactic Name: volta_scudnn_128x128_relu_xregs_large_nn_v1
UNKNOWN: Tactic: 6448355332020552203 time 4.43795
UNKNOWN: conv1 (scudnn) Set Tactic Name: volta_scudnn_128x64_relu_small_nn_v1
UNKNOWN: Tactic: 6808617066150061604 time 1.47357
UNKNOWN: conv1 (scudnn) Set Tactic Name: volta_scudnn_128x64_relu_interior_nn_v1
UNKNOWN: Tactic: 9091006216302412844 time 1.4336
UNKNOWN: conv1 (scudnn) Set Tactic Name: volta_scudnn_128x64_relu_medium_nn_v1
UNKNOWN: Tactic: -8060443123034038864 time 1.50218
UNKNOWN: conv1 (scudnn) Set Tactic Name: volta_scudnn_128x32_relu_medium_nn_v1
UNKNOWN: Tactic: -4420849921117327522 time 0.861312
UNKNOWN: conv1 (scudnn) Set Tactic Name: volta_scudnn_128x32_relu_small_nn_v1
UNKNOWN: Tactic: -3946921629105938337 time 0.746528
UNKNOWN: Fastest Tactic: 2733356012094739613 Time: 0.722944
UNKNOWN: --------------- Timing Runner: conv1 (CudaConvolution)
UNKNOWN: Tactic: 0 time 1.04854
UNKNOWN: Tactic: 2 time 2.12355
UNKNOWN: Tactic: 5 time 8.81053
UNKNOWN: Tactic: 6 time 1.29126
UNKNOWN: Tactic: 57 time 1.04685
UNKNOWN: Fastest Tactic: 57 Time: 1.04685
UNKNOWN: --------------- Timing Runner: conv1 (CudaDepthwiseConvolution)
UNKNOWN: CudaDepthwiseConvolution has no valid tactics for this config, skipping
UNKNOWN: >>>>>>>>>>>>>>> Chose Runner Type: CaskConvolution Tactic: 2733356012094739613
UNKNOWN: conv1 (scudnn) Set Tactic Name: volta_scudnn_128x32_relu_interior_nn_v1
UNKNOWN: 
UNKNOWN: conv1 (scudnn) Set Tactic Name: volta_scudnn_128x128_relu_interior_nn_v1
UNKNOWN: conv1 (scudnn) Set Tactic Name: volta_scudnn_128x128_relu_medium_nn_v1
UNKNOWN: conv1 (scudnn) Set Tactic Name: volta_scudnn_128x32_relu_interior_nn_v1
UNKNOWN: conv1 (scudnn_winograd) Set Tactic Name: volta_scudnn_winograd_128x128_ldg1_ldg4_relu_tile148t_nt_v1
UNKNOWN: conv1 (scudnn) Set Tactic Name: volta_scudnn_128x64_relu_xregs_large_nn_v1
UNKNOWN: conv1 (scudnn) Set Tactic Name: volta_scudnn_128x128_relu_small_nn_v1
UNKNOWN: conv1 (scudnn) Set Tactic Name: volta_scudnn_128x128_relu_xregs_large_nn_v1
UNKNOWN: conv1 (scudnn) Set Tactic Name: volta_scudnn_128x64_relu_small_nn_v1
UNKNOWN: conv1 (scudnn) Set Tactic Name: volta_scudnn_128x64_relu_interior_nn_v1
UNKNOWN: conv1 (scudnn) Set Tactic Name: volta_scudnn_128x64_relu_medium_nn_v1
UNKNOWN: conv1 (scudnn) Set Tactic Name: volta_scudnn_128x32_relu_medium_nn_v1
UNKNOWN: conv1 (scudnn) Set Tactic Name: volta_scudnn_128x32_relu_small_nn_v1
UNKNOWN: conv1 (scudnn) Set Tactic Name: volta_scudnn_128x32_relu_interior_nn_v1
UNKNOWN: --------------- Timing Runner: <reformat> (Reformat)
UNKNOWN: Tactic: 1002 time 1.14285
UNKNOWN: Tactic: 0 time 0.954496
UNKNOWN: Fastest Tactic: 0 Time: 0.954496
UNKNOWN: --------------- Timing Runner: <reformat> (Reformat)
UNKNOWN: Tactic: 1002 time 0.781408
UNKNOWN: Tactic: 0 time 0.760384
UNKNOWN: Fastest Tactic: 0 Time: 0.760384
UNKNOWN: *************** Autotuning format combination: Float(1,382,81748,817480) -> Float(1,382,81748,817480) ***************
UNKNOWN: --------------- Timing Runner: scale1_1 + ReLU1_2 (Scale)
UNKNOWN: Tactic: 0 is the only option, timing skipped
UNKNOWN: Fastest Tactic: 0 Time: 0
UNKNOWN: *************** Autotuning format combination: Float(1,382,81748,817480) -> Float(1,382,81748,817480) ***************
UNKNOWN: --------------- Timing Runner: scale1_2 (Scale)
UNKNOWN: Tactic: 0 is the only option, timing skipped
UNKNOWN: Fastest Tactic: 0 Time: 0
UNKNOWN: --------------- Timing Runner: <reformat> (Reformat)
UNKNOWN: Tactic: 1002 time 1.14195
UNKNOWN: Tactic: 0 time 0.951616
UNKNOWN: Fastest Tactic: 0 Time: 0.951616
UNKNOWN: *************** Autotuning format combination: Float(1,382,81748,817480), Float(1,382,81748,817480) -> Float(1,382,81748,817480) ***************
UNKNOWN: --------------- Timing Runner: PWN(ReLU1, eltwise-sum1) (PointWise)
UNKNOWN: Tactic: 128 time 1.86246
UNKNOWN: Tactic: 256 time 1.85664
UNKNOWN: Tactic: 512 time 1.85958
UNKNOWN: Tactic: -32 time 2.22618
UNKNOWN: Tactic: -64 time 1.18582
UNKNOWN: Tactic: -128 time 1.18371
UNKNOWN: Fastest Tactic: -128 Time: 1.18371
UNKNOWN: --------------- Timing Runner: PWN(ReLU1, eltwise-sum1) (PointWiseV2)
UNKNOWN: Tactic: 0 time 0.54064
UNKNOWN: Tactic: 1 time 0.540672
UNKNOWN: Tactic: 2 time 0.57344
UNKNOWN: Tactic: 3 time 0.543744
UNKNOWN: Tactic: 4 time 0.54784
UNKNOWN: Tactic: 5 time 0.567296
UNKNOWN: Tactic: 6 time 0.544768
UNKNOWN: Tactic: 7 time 0.543744
UNKNOWN: Tactic: 8 time 0.544768
UNKNOWN: Tactic: 9 time 0.543808
UNKNOWN: Tactic: 28 time 0.544768
UNKNOWN: Fastest Tactic: 0 Time: 0.54064
UNKNOWN: >>>>>>>>>>>>>>> Chose Runner Type: PointWiseV2 Tactic: 0
UNKNOWN: 
UNKNOWN: *************** Autotuning format combination: Float(1,382,81748:32,81748), Float(1,382,81748:32,81748) -> Float(1,382,81748:32,81748) ***************
UNKNOWN: --------------- Timing Runner: PWN(ReLU1, eltwise-sum1) (PointWise)
UNKNOWN: Tactic: 128 time 3.25734
UNKNOWN: Tactic: 256 time 3.26451
UNKNOWN: Tactic: 512 time 3.25939
UNKNOWN: Tactic: -32 time 3.2071
UNKNOWN: Tactic: -64 time 2.63277
UNKNOWN: Tactic: -128 time 2.94704
UNKNOWN: Fastest Tactic: -64 Time: 2.63277
UNKNOWN: --------------- Timing Runner: PWN(ReLU1, eltwise-sum1) (PointWiseV2)
UNKNOWN: Tactic: 24 time 1.95683
UNKNOWN: Tactic: 25 time 1.93843
UNKNOWN: Tactic: 26 time 1.90874
UNKNOWN: Tactic: 27 time 1.89955
UNKNOWN: Tactic: 31 time 1.95786
UNKNOWN: Fastest Tactic: 27 Time: 1.89955
UNKNOWN: >>>>>>>>>>>>>>> Chose Runner Type: PointWiseV2 Tactic: 27
UNKNOWN: 
UNKNOWN: *************** Autotuning format combination: Float(1,382,81748,817480) -> Float(1,191,20437,204370) ***************
UNKNOWN: --------------- Timing Runner: pool1 (Pooling)
UNKNOWN: Tactic: -1 time 0.19664
UNKNOWN: Fastest Tactic: -1 Time: 0.19664
UNKNOWN: --------------- Timing Runner: pool1 (TiledPooling)
UNKNOWN: Tactic: 5505281 time 0.287744
UNKNOWN: Tactic: 5570817 time 0.19456
UNKNOWN: Tactic: 5636353 time 0.190496
UNKNOWN: Tactic: 5701889 time 0.19248
UNKNOWN: Tactic: 5767425 time 0.19152
UNKNOWN: Tactic: 5832961 time 0.19152
UNKNOWN: Tactic: 5898497 time 0.191424
UNKNOWN: Tactic: 5964033 time 0.192512
UNKNOWN: Tactic: 6029569 time 0.285664
UNKNOWN: Tactic: 6095105 time 0.207872
UNKNOWN: Tactic: 6160641 time 0.208896
UNKNOWN: Tactic: 6226177 time 0.207872
UNKNOWN: Tactic: 6291713 time 0.207872
UNKNOWN: Tactic: 6357249 time 0.207904
UNKNOWN: Tactic: 6422785 time 0.20784
UNKNOWN: Tactic: 6488321 time 0.208896
UNKNOWN: Fastest Tactic: 5636353 Time: 0.190496
UNKNOWN: >>>>>>>>>>>>>>> Chose Runner Type: TiledPooling Tactic: 5636353
UNKNOWN: 
UNKNOWN: *************** Autotuning format combination: Float(1,191,20437,204370) -> Float(1,189,19845,317520) ***************
UNKNOWN: conv2 (scudnn) Set Tactic Name: volta_scudnn_128x128_relu_interior_nn_v1
UNKNOWN: conv2 (scudnn) Set Tactic Name: volta_scudnn_128x128_relu_medium_nn_v1
UNKNOWN: conv2 (scudnn) Set Tactic Name: volta_scudnn_128x32_relu_interior_nn_v1
UNKNOWN: conv2 (scudnn_winograd) Set Tactic Name: volta_scudnn_winograd_128x128_ldg1_ldg4_relu_tile148t_nt_v1
UNKNOWN: conv2 (scudnn) Set Tactic Name: volta_scudnn_128x64_relu_xregs_large_nn_v1
UNKNOWN: conv2 (scudnn) Set Tactic Name: volta_scudnn_128x128_relu_small_nn_v1
UNKNOWN: conv2 (scudnn) Set Tactic Name: volta_scudnn_128x128_relu_xregs_large_nn_v1
UNKNOWN: conv2 (scudnn) Set Tactic Name: volta_scudnn_128x64_relu_small_nn_v1
UNKNOWN: conv2 (scudnn) Set Tactic Name: volta_scudnn_128x64_relu_interior_nn_v1
UNKNOWN: conv2 (scudnn) Set Tactic Name: volta_scudnn_128x64_relu_medium_nn_v1
UNKNOWN: conv2 (scudnn) Set Tactic Name: volta_scudnn_128x32_relu_medium_nn_v1
UNKNOWN: conv2 (scudnn) Set Tactic Name: volta_scudnn_128x32_relu_small_nn_v1
UNKNOWN: --------------- Timing Runner: conv2 (FusedConvActConvolution)
UNKNOWN: Tactic: 524287 time 0.70736
UNKNOWN: Tactic: 720895 time 0.933856
UNKNOWN: Tactic: 1048575 time 0.637824
UNKNOWN: Tactic: 1966079 time 1.04134
UNKNOWN: Tactic: 2031615 time 1.00659
UNKNOWN: Tactic: 2752511 time 0.917504
UNKNOWN: Tactic: 2883583 time 1.7695
UNKNOWN: Tactic: 3473407 time 1.79395
UNKNOWN: Tactic: 3735551 time 1.70906
UNKNOWN: Tactic: 4390911 time 1.07936
UNKNOWN: Tactic: 5046271 time 0.636896
UNKNOWN: Tactic: 5963775 time 1.0281
UNKNOWN: Tactic: 6160383 time 0.712672
UNKNOWN: Tactic: 6488063 time 0.605344
UNKNOWN: Tactic: 6881279 time 0.978688
UNKNOWN: Tactic: 7995391 time 0.917696
UNKNOWN: Tactic: 8585215 time 0.731104
UNKNOWN: Tactic: 8978431 time 0.995168
UNKNOWN: Tactic: 9502719 time 0.986304
UNKNOWN: Tactic: 9830399 time 1.70493
UNKNOWN: Tactic: 10027007 time 0.603104
UNKNOWN: Tactic: 10092543 time 1.09264
UNKNOWN: Tactic: 10289151 time 1.01376
UNKNOWN: Fastest Tactic: 10027007 Time: 0.603104
UNKNOWN: --------------- Timing Runner: conv2 (CaskConvolution)
UNKNOWN: conv2 (scudnn) Set Tactic Name: volta_scudnn_128x128_relu_interior_nn_v1
UNKNOWN: Tactic: 1754569683116234317 time 1.79504
UNKNOWN: conv2 (scudnn) Set Tactic Name: volta_scudnn_128x128_relu_medium_nn_v1
UNKNOWN: Tactic: 1825138533642645384 time 1.80224
UNKNOWN: conv2 (scudnn) Set Tactic Name: volta_scudnn_128x32_relu_interior_nn_v1
UNKNOWN: Tactic: 2733356012094739613 time 0.493696
UNKNOWN: conv2 (scudnn_winograd) Set Tactic Name: volta_scudnn_winograd_128x128_ldg1_ldg4_relu_tile148t_nt_v1
UNKNOWN: Tactic: 2775507031594384867 time 0.418688
UNKNOWN: conv2 (scudnn) Set Tactic Name: volta_scudnn_128x64_relu_xregs_large_nn_v1
UNKNOWN: Tactic: 2842488832350522458 time 0.73696
UNKNOWN: conv2 (scudnn) Set Tactic Name: volta_scudnn_128x128_relu_small_nn_v1
UNKNOWN: Tactic: 3915320020053085238 time 1.43562
UNKNOWN: conv2 (scudnn) Set Tactic Name: volta_scudnn_128x128_relu_xregs_large_nn_v1
UNKNOWN: Tactic: 6448355332020552203 time 1.72365
UNKNOWN: conv2 (scudnn) Set Tactic Name: volta_scudnn_128x64_relu_small_nn_v1
UNKNOWN: Tactic: 6808617066150061604 time 0.722944
UNKNOWN: conv2 (scudnn) Set Tactic Name: volta_scudnn_128x64_relu_interior_nn_v1
UNKNOWN: Tactic: 9091006216302412844 time 0.697376
UNKNOWN: conv2 (scudnn) Set Tactic Name: volta_scudnn_128x64_relu_medium_nn_v1
UNKNOWN: Tactic: -8060443123034038864 time 0.735296
UNKNOWN: conv2 (scudnn) Set Tactic Name: volta_scudnn_128x32_relu_medium_nn_v1
UNKNOWN: Tactic: -4420849921117327522 time 0.400544
UNKNOWN: conv2 (scudnn) Set Tactic Name: volta_scudnn_128x32_relu_small_nn_v1
UNKNOWN: Tactic: -3946921629105938337 time 0.4024
UNKNOWN: Fastest Tactic: -4420849921117327522 Time: 0.400544
UNKNOWN: --------------- Timing Runner: conv2 (CudaConvolution)
UNKNOWN: Tactic: 0 time 0.604992
UNKNOWN: Tactic: 2 time 2.41878
UNKNOWN: Tactic: 5 time 3.6447
UNKNOWN: Tactic: 6 time 0.508928
UNKNOWN: Tactic: 57 time 0.608256
UNKNOWN: Fastest Tactic: 6 Time: 0.508928
UNKNOWN: --------------- Timing Runner: conv2 (CudaDepthwiseConvolution)
UNKNOWN: CudaDepthwiseConvolution has no valid tactics for this config, skipping
UNKNOWN: >>>>>>>>>>>>>>> Chose Runner Type: CaskConvolution Tactic: -4420849921117327522
UNKNOWN: conv2 (scudnn) Set Tactic Name: volta_scudnn_128x32_relu_medium_nn_v1
UNKNOWN: 
UNKNOWN: conv2 (scudnn) Set Tactic Name: volta_scudnn_128x128_relu_interior_nn_v1
UNKNOWN: conv2 (scudnn) Set Tactic Name: volta_scudnn_128x128_relu_medium_nn_v1
UNKNOWN: conv2 (scudnn) Set Tactic Name: volta_scudnn_128x32_relu_interior_nn_v1
UNKNOWN: conv2 (scudnn_winograd) Set Tactic Name: volta_scudnn_winograd_128x128_ldg1_ldg4_relu_tile148t_nt_v1
UNKNOWN: conv2 (scudnn) Set Tactic Name: volta_scudnn_128x64_relu_xregs_large_nn_v1
UNKNOWN: conv2 (scudnn) Set Tactic Name: volta_scudnn_128x128_relu_small_nn_v1
UNKNOWN: conv2 (scudnn) Set Tactic Name: volta_scudnn_128x128_relu_xregs_large_nn_v1
UNKNOWN: conv2 (scudnn) Set Tactic Name: volta_scudnn_128x64_relu_small_nn_v1
UNKNOWN: conv2 (scudnn) Set Tactic Name: volta_scudnn_128x64_relu_interior_nn_v1
UNKNOWN: conv2 (scudnn) Set Tactic Name: volta_scudnn_128x64_relu_medium_nn_v1
UNKNOWN: conv2 (scudnn) Set Tactic Name: volta_scudnn_128x32_relu_medium_nn_v1
UNKNOWN: conv2 (scudnn) Set Tactic Name: volta_scudnn_128x32_relu_small_nn_v1
UNKNOWN: conv2 (scudnn) Set Tactic Name: volta_scudnn_128x32_relu_medium_nn_v1
UNKNOWN: --------------- Timing Runner: <reformat> (Reformat)
UNKNOWN: Tactic: 1002 time 0.36848
UNKNOWN: Tactic: 0 time 0.442304
UNKNOWN: Fastest Tactic: 1002 Time: 0.36848
UNKNOWN: --------------- Timing Runner: <reformat> (Reformat)
UNKNOWN: Tactic: 1002 time 0.360512
UNKNOWN: Tactic: 0 time 0.35328
UNKNOWN: Fastest Tactic: 0 Time: 0.35328
UNKNOWN: *************** Autotuning format combination: Float(1,189,19845,317520) -> Float(1,189,19845,317520) ***************
UNKNOWN: --------------- Timing Runner: scale2_1 + ReLU2_2 (Scale)
UNKNOWN: Tactic: 0 is the only option, timing skipped
UNKNOWN: Fastest Tactic: 0 Time: 0
UNKNOWN: *************** Autotuning format combination: Float(1,189,19845,317520) -> Float(1,189,19845,317520) ***************
UNKNOWN: --------------- Timing Runner: scale2_2 (Scale)
UNKNOWN: Tactic: 0 is the only option, timing skipped
UNKNOWN: Fastest Tactic: 0 Time: 0
UNKNOWN: --------------- Timing Runner: <reformat> (Reformat)
UNKNOWN: Tactic: 1002 time 0.373728
UNKNOWN: Tactic: 0 time 0.44224
UNKNOWN: Fastest Tactic: 1002 Time: 0.373728
UNKNOWN: *************** Autotuning format combination: Float(1,189,19845,317520), Float(1,189,19845,317520) -> Float(1,189,19845,317520) ***************
UNKNOWN: --------------- Timing Runner: PWN(ReLU2, eltwise-sum2) (PointWise)
UNKNOWN: Tactic: 128 time 0.166816
UNKNOWN: Tactic: 256 time 0.167936
UNKNOWN: Tactic: 512 time 0.168096
UNKNOWN: Tactic: -32 time 0.229728
UNKNOWN: Tactic: -64 time 0.205088
UNKNOWN: Tactic: -128 time 0.195552
UNKNOWN: Fastest Tactic: 128 Time: 0.166816
UNKNOWN: --------------- Timing Runner: PWN(ReLU2, eltwise-sum2) (PointWiseV2)
UNKNOWN: Tactic: 0 time 0.093184
UNKNOWN: Tactic: 1 time 0.092096
UNKNOWN: Tactic: 2 time 0.09024
UNKNOWN: Tactic: 3 time 0.09088
UNKNOWN: Tactic: 4 time 0.090112
UNKNOWN: Tactic: 5 time 0.089952
UNKNOWN: Tactic: 6 time 0.094208
UNKNOWN: Tactic: 7 time 0.090176
UNKNOWN: Tactic: 8 time 0.089088
UNKNOWN: Tactic: 9 time 0.090144
UNKNOWN: Tactic: 28 time 0.092352
UNKNOWN: Fastest Tactic: 8 Time: 0.089088
UNKNOWN: >>>>>>>>>>>>>>> Chose Runner Type: PointWiseV2 Tactic: 8
UNKNOWN: 
UNKNOWN: *************** Autotuning format combination: Float(1,189,19845:32,19845), Float(1,189,19845:32,19845) -> Float(1,189,19845:32,19845) ***************
UNKNOWN: --------------- Timing Runner: PWN(ReLU2, eltwise-sum2) (PointWise)
UNKNOWN: Tactic: 128 time 0.324608
UNKNOWN: Tactic: 256 time 0.324288
UNKNOWN: Tactic: 512 time 0.324832
UNKNOWN: Tactic: -32 time 0.406592
UNKNOWN: Tactic: -64 time 0.371392
UNKNOWN: Tactic: -128 time 0.371744
UNKNOWN: Fastest Tactic: 256 Time: 0.324288
UNKNOWN: --------------- Timing Runner: PWN(ReLU2, eltwise-sum2) (PointWiseV2)
UNKNOWN: Tactic: 24 time 0.291872
UNKNOWN: Tactic: 25 time 0.294944
UNKNOWN: Tactic: 26 time 0.294624
UNKNOWN: Tactic: 27 time 0.296896
UNKNOWN: Tactic: 31 time 0.289952
UNKNOWN: Fastest Tactic: 31 Time: 0.289952
UNKNOWN: >>>>>>>>>>>>>>> Chose Runner Type: PointWiseV2 Tactic: 31
UNKNOWN: 
UNKNOWN: *************** Autotuning format combination: Float(1,189,19845,317520) -> Float(1,187,19261,616352) ***************
UNKNOWN: conv3 (scudnn) Set Tactic Name: volta_scudnn_128x128_relu_interior_nn_v1
UNKNOWN: conv3 (scudnn) Set Tactic Name: volta_scudnn_128x128_relu_medium_nn_v1
UNKNOWN: conv3 (scudnn) Set Tactic Name: volta_scudnn_128x32_relu_interior_nn_v1
UNKNOWN: conv3 (scudnn_winograd) Set Tactic Name: volta_scudnn_winograd_128x128_ldg1_ldg4_relu_tile148t_nt_v1
UNKNOWN: conv3 (scudnn) Set Tactic Name: volta_scudnn_128x64_relu_xregs_large_nn_v1
UNKNOWN: conv3 (scudnn) Set Tactic Name: volta_scudnn_128x128_relu_small_nn_v1
UNKNOWN: conv3 (scudnn) Set Tactic Name: volta_scudnn_128x128_relu_xregs_large_nn_v1
UNKNOWN: conv3 (scudnn) Set Tactic Name: volta_scudnn_128x64_relu_small_nn_v1
UNKNOWN: conv3 (scudnn) Set Tactic Name: volta_scudnn_128x64_relu_interior_nn_v1
UNKNOWN: conv3 (scudnn) Set Tactic Name: volta_scudnn_128x64_relu_medium_nn_v1
UNKNOWN: conv3 (scudnn) Set Tactic Name: volta_scudnn_128x32_relu_medium_nn_v1
UNKNOWN: conv3 (scudnn) Set Tactic Name: volta_scudnn_128x32_relu_small_nn_v1
UNKNOWN: --------------- Timing Runner: conv3 (FusedConvActConvolution)
UNKNOWN: FusedConvActConvolution has no valid tactics for this config, skipping
UNKNOWN: --------------- Timing Runner: conv3 (CaskConvolution)
UNKNOWN: conv3 (scudnn) Set Tactic Name: volta_scudnn_128x128_relu_interior_nn_v1
UNKNOWN: Tactic: 1754569683116234317 time 2.06029
UNKNOWN: conv3 (scudnn) Set Tactic Name: volta_scudnn_128x128_relu_medium_nn_v1
UNKNOWN: Tactic: 1825138533642645384 time 2.05002
UNKNOWN: conv3 (scudnn) Set Tactic Name: volta_scudnn_128x32_relu_interior_nn_v1
UNKNOWN: Tactic: 2733356012094739613 time 0.544736
UNKNOWN: conv3 (scudnn_winograd) Set Tactic Name: volta_scudnn_winograd_128x128_ldg1_ldg4_relu_tile148t_nt_v1
UNKNOWN: Tactic: 2775507031594384867 time 0.401408
UNKNOWN: conv3 (scudnn) Set Tactic Name: volta_scudnn_128x64_relu_xregs_large_nn_v1
UNKNOWN: Tactic: 2842488832350522458 time 1.04266
UNKNOWN: conv3 (scudnn) Set Tactic Name: volta_scudnn_128x128_relu_small_nn_v1
UNKNOWN: Tactic: 3915320020053085238 time 2.05312
UNKNOWN: conv3 (scudnn) Set Tactic Name: volta_scudnn_128x128_relu_xregs_large_nn_v1
UNKNOWN: Tactic: 6448355332020552203 time 2.3593
UNKNOWN: conv3 (scudnn) Set Tactic Name: volta_scudnn_128x64_relu_small_nn_v1
UNKNOWN: Tactic: 6808617066150061604 time 1.05059
UNKNOWN: conv3 (scudnn) Set Tactic Name: volta_scudnn_128x64_relu_interior_nn_v1
UNKNOWN: Tactic: 9091006216302412844 time 1.01181
UNKNOWN: conv3 (scudnn) Set Tactic Name: volta_scudnn_128x64_relu_medium_nn_v1
UNKNOWN: Tactic: -8060443123034038864 time 1.06195
UNKNOWN: conv3 (scudnn) Set Tactic Name: volta_scudnn_128x32_relu_medium_nn_v1
UNKNOWN: Tactic: -4420849921117327522 time 0.583584
UNKNOWN: conv3 (scudnn) Set Tactic Name: volta_scudnn_128x32_relu_small_nn_v1
UNKNOWN: Tactic: -3946921629105938337 time 0.580704
UNKNOWN: Fastest Tactic: 2775507031594384867 Time: 0.401408
UNKNOWN: --------------- Timing Runner: conv3 (CudaConvolution)
UNKNOWN: Tactic: 0 time 0.936896
UNKNOWN: Tactic: 2 time 7.2855
UNKNOWN: Tactic: 5 time 6.8393
UNKNOWN: Tactic: 6 time 0.501504
UNKNOWN: Tactic: 57 time 0.810976
UNKNOWN: Fastest Tactic: 6 Time: 0.501504
UNKNOWN: --------------- Timing Runner: conv3 (CudaDepthwiseConvolution)
UNKNOWN: CudaDepthwiseConvolution has no valid tactics for this config, skipping
UNKNOWN: >>>>>>>>>>>>>>> Chose Runner Type: CaskConvolution Tactic: 2775507031594384867
UNKNOWN: conv3 (scudnn_winograd) Set Tactic Name: volta_scudnn_winograd_128x128_ldg1_ldg4_relu_tile148t_nt_v1
UNKNOWN: 
UNKNOWN: conv3 (scudnn) Set Tactic Name: volta_scudnn_128x128_relu_interior_nn_v1
UNKNOWN: conv3 (scudnn) Set Tactic Name: volta_scudnn_128x128_relu_medium_nn_v1
UNKNOWN: conv3 (scudnn) Set Tactic Name: volta_scudnn_128x32_relu_interior_nn_v1
UNKNOWN: conv3 (scudnn_winograd) Set Tactic Name: volta_scudnn_winograd_128x128_ldg1_ldg4_relu_tile148t_nt_v1
UNKNOWN: conv3 (scudnn) Set Tactic Name: volta_scudnn_128x64_relu_xregs_large_nn_v1
UNKNOWN: conv3 (scudnn) Set Tactic Name: volta_scudnn_128x128_relu_small_nn_v1
UNKNOWN: conv3 (scudnn) Set Tactic Name: volta_scudnn_128x128_relu_xregs_large_nn_v1
UNKNOWN: conv3 (scudnn) Set Tactic Name: volta_scudnn_128x64_relu_small_nn_v1
UNKNOWN: conv3 (scudnn) Set Tactic Name: volta_scudnn_128x64_relu_interior_nn_v1
UNKNOWN: conv3 (scudnn) Set Tactic Name: volta_scudnn_128x64_relu_medium_nn_v1
UNKNOWN: conv3 (scudnn) Set Tactic Name: volta_scudnn_128x32_relu_medium_nn_v1
UNKNOWN: conv3 (scudnn) Set Tactic Name: volta_scudnn_128x32_relu_small_nn_v1
UNKNOWN: conv3 (scudnn_winograd) Set Tactic Name: volta_scudnn_winograd_128x128_ldg1_ldg4_relu_tile148t_nt_v1
UNKNOWN: --------------- Timing Runner: <reformat> (Reformat)
UNKNOWN: Tactic: 1002 time 0.308224
UNKNOWN: Tactic: 0 time 0.720544
UNKNOWN: Fastest Tactic: 1002 Time: 0.308224
UNKNOWN: --------------- Timing Runner: <reformat> (Reformat)
UNKNOWN: Tactic: 1002 time 0.598688
UNKNOWN: Tactic: 0 time 0.576704
UNKNOWN: Fastest Tactic: 0 Time: 0.576704
UNKNOWN: *************** Autotuning format combination: Float(1,187,19261,616352) -> Float(1,187,19261,616352) ***************
UNKNOWN: --------------- Timing Runner: scale3_1 + ReLU3_2 (Scale)
UNKNOWN: Tactic: 0 is the only option, timing skipped
UNKNOWN: Fastest Tactic: 0 Time: 0
UNKNOWN: *************** Autotuning format combination: Float(1,187,19261,616352) -> Float(1,187,19261,616352) ***************
UNKNOWN: --------------- Timing Runner: scale3_2 (Scale)
UNKNOWN: Tactic: 0 is the only option, timing skipped
UNKNOWN: Fastest Tactic: 0 Time: 0
UNKNOWN: --------------- Timing Runner: <reformat> (Reformat)
UNKNOWN: Tactic: 1002 time 0.31312
UNKNOWN: Tactic: 0 time 0.720192
UNKNOWN: Fastest Tactic: 1002 Time: 0.31312
UNKNOWN: *************** Autotuning format combination: Float(1,187,19261,616352), Float(1,187,19261,616352) -> Float(1,187,19261,616352) ***************
UNKNOWN: --------------- Timing Runner: PWN(ReLU3, eltwise-sum3) (PointWise)
UNKNOWN: Tactic: 128 time 0.268448
UNKNOWN: Tactic: 256 time 0.269312
UNKNOWN: Tactic: 512 time 0.269312
UNKNOWN: Tactic: -32 time 0.345088
UNKNOWN: Tactic: -64 time 0.310304
UNKNOWN: Tactic: -128 time 0.31264
UNKNOWN: Fastest Tactic: 128 Time: 0.268448
UNKNOWN: --------------- Timing Runner: PWN(ReLU3, eltwise-sum3) (PointWiseV2)
UNKNOWN: Tactic: 0 time 0.161824
UNKNOWN: Tactic: 1 time 0.161152
UNKNOWN: Tactic: 2 time 0.158304
UNKNOWN: Tactic: 3 time 0.162048
UNKNOWN: Tactic: 4 time 0.159456
UNKNOWN: Tactic: 5 time 0.15872
UNKNOWN: Tactic: 6 time 0.163648
UNKNOWN: Tactic: 7 time 0.159936
UNKNOWN: Tactic: 8 time 0.159776
UNKNOWN: Tactic: 9 time 0.158944
UNKNOWN: Tactic: 28 time 0.160288
UNKNOWN: Fastest Tactic: 2 Time: 0.158304
UNKNOWN: >>>>>>>>>>>>>>> Chose Runner Type: PointWiseV2 Tactic: 2
UNKNOWN: 
UNKNOWN: *************** Autotuning format combination: Float(1,187,19261:32,19261), Float(1,187,19261:32,19261) -> Float(1,187,19261:32,19261) ***************
UNKNOWN: --------------- Timing Runner: PWN(ReLU3, eltwise-sum3) (PointWise)
UNKNOWN: Tactic: 128 time 0.231424
UNKNOWN: Tactic: 256 time 0.23024
UNKNOWN: Tactic: 512 time 0.232448
UNKNOWN: Tactic: -32 time 0.300352
UNKNOWN: Tactic: -64 time 0.2672
UNKNOWN: Tactic: -128 time 0.270368
UNKNOWN: Fastest Tactic: 256 Time: 0.23024
UNKNOWN: --------------- Timing Runner: PWN(ReLU3, eltwise-sum3) (PointWiseV2)
UNKNOWN: Tactic: 24 time 0.270592
UNKNOWN: Tactic: 25 time 0.279264
UNKNOWN: Tactic: 26 time 0.293856
UNKNOWN: Tactic: 27 time 0.286592
UNKNOWN: Tactic: 31 time 0.274432
UNKNOWN: Fastest Tactic: 24 Time: 0.270592
UNKNOWN: >>>>>>>>>>>>>>> Chose Runner Type: PointWise Tactic: 256
UNKNOWN: 
UNKNOWN: --------------- Timing Runner: <reformat> (Reformat)
UNKNOWN: Tactic: 1002 time 0.516
UNKNOWN: Tactic: 0 time 0.494848
UNKNOWN: Fastest Tactic: 0 Time: 0.494848
UNKNOWN: *************** Autotuning format combination: Float(1,187,19261,616352) -> Float(1,187,19261,77044) ***************
UNKNOWN: conv4-2 (scudnn) Set Tactic Name: volta_scudnn_128x128_relu_interior_nn_v1
UNKNOWN: conv4-2 (scudnn) Set Tactic Name: volta_scudnn_128x128_relu_medium_nn_v1
UNKNOWN: conv4-2 (scudnn) Set Tactic Name: volta_scudnn_128x32_relu_interior_nn_v1
UNKNOWN: conv4-2 (scudnn) Set Tactic Name: volta_scudnn_128x128_relu_small_nn_v1
UNKNOWN: conv4-2 (scudnn) Set Tactic Name: volta_scudnn_128x64_relu_small_nn_v1
UNKNOWN: conv4-2 (scudnn) Set Tactic Name: volta_scudnn_128x64_relu_interior_nn_v1
UNKNOWN: conv4-2 (scudnn) Set Tactic Name: volta_scudnn_128x64_relu_medium_nn_v1
UNKNOWN: conv4-2 (scudnn) Set Tactic Name: volta_scudnn_128x32_relu_medium_nn_v1
UNKNOWN: conv4-2 (scudnn) Set Tactic Name: volta_scudnn_128x32_relu_small_nn_v1
UNKNOWN: --------------- Timing Runner: conv4-2 (FusedConvActConvolution)
UNKNOWN: Tactic: 589823 time 0.212192
UNKNOWN: Tactic: 655359 time 0.5128
UNKNOWN: Tactic: 786431 time 0.207936
UNKNOWN: Tactic: 851967 time 0.862752
UNKNOWN: Tactic: 1179647 time 0.453856
UNKNOWN: Tactic: 1310719 time 0.378112
UNKNOWN: Tactic: 1376255 time 0.291744
UNKNOWN: Tactic: 1441791 time 0.777216
UNKNOWN: Tactic: 1507327 time 0.632896
UNKNOWN: Tactic: 1638399 time 0.2656
UNKNOWN: Tactic: 1835007 time 0.20256
UNKNOWN: Tactic: 1900543 time 0.579936
UNKNOWN: Tactic: 2097151 time 0.360512
UNKNOWN: Tactic: 2162687 time 0.256224
UNKNOWN: Tactic: 2293759 time 0.275872
UNKNOWN: Tactic: 2359295 time 0.290592
UNKNOWN: Tactic: 2686975 time 0.252672
UNKNOWN: Tactic: 3080191 time 0.59232
UNKNOWN: Tactic: 3342335 time 0.64208
UNKNOWN: Tactic: 3407871 time 0.3072
UNKNOWN: Tactic: 3538943 time 0.338912
UNKNOWN: Tactic: 3670015 time 0.465952
UNKNOWN: Tactic: 3932159 time 0.487584
UNKNOWN: Tactic: 3997695 time 0.237728
UNKNOWN: Tactic: 4063231 time 0.851456
UNKNOWN: Tactic: 4194303 time 0.179168
UNKNOWN: Tactic: 4259839 time 0.328704
UNKNOWN: Tactic: 4325375 time 0.207744
UNKNOWN: Tactic: 4521983 time 0.182016
UNKNOWN: Tactic: 4587519 time 0.202752
UNKNOWN: Tactic: 4653055 time 0.394432
UNKNOWN: Tactic: 4915199 time 0.20192
UNKNOWN: Tactic: 4980735 time 0.186304
UNKNOWN: Tactic: 5177343 time 0.462464
UNKNOWN: Tactic: 5242879 time 0.293792
UNKNOWN: Tactic: 5373951 time 0.532352
UNKNOWN: Tactic: 5439487 time 0.33472
UNKNOWN: Tactic: 5570559 time 0.635648
UNKNOWN: Tactic: 5636095 time 0.848032
UNKNOWN: Tactic: 5701631 time 0.255328
UNKNOWN: Tactic: 5767167 time 0.688128
UNKNOWN: Tactic: 5832703 time 0.302144
UNKNOWN: Tactic: 5898239 time 0.475136
UNKNOWN: Tactic: 6029311 time 0.269312
UNKNOWN: Tactic: 6225919 time 0.31744
UNKNOWN: Tactic: 6291455 time 0.454528
UNKNOWN: Tactic: 6422527 time 0.539808
UNKNOWN: Tactic: 6750207 time 0.271392
UNKNOWN: Tactic: 6815743 time 0.359424
UNKNOWN: Tactic: 6946815 time 0.299392
UNKNOWN: Tactic: 7012351 time 0.361984
UNKNOWN: Tactic: 7077887 time 0.330752
UNKNOWN: Tactic: 7143423 time 0.2872
UNKNOWN: Tactic: 7208959 time 0.302208
UNKNOWN: Tactic: 7340031 time 0.472
UNKNOWN: Tactic: 7405567 time 0.391072
UNKNOWN: Tactic: 7536639 time 0.337664
UNKNOWN: Tactic: 7602175 time 0.198432
UNKNOWN: Tactic: 7733247 time 0.337952
UNKNOWN: Tactic: 7798783 time 0.206944
UNKNOWN: Tactic: 8191999 time 0.278592
UNKNOWN: Tactic: 8257535 time 0.254592
UNKNOWN: Tactic: 8323071 time 0.228384
UNKNOWN: Tactic: 8650751 time 0.225568
UNKNOWN: Tactic: 8716287 time 0.403616
UNKNOWN: Tactic: 9109503 time 0.370208
UNKNOWN: Tactic: 9568255 time 0.202656
UNKNOWN: Tactic: 9895935 time 0.181504
UNKNOWN: Tactic: 10223615 time 0.252224
UNKNOWN: Tactic: 10354687 time 0.276896
UNKNOWN: Tactic: 10551295 time 0.199712
UNKNOWN: Tactic: 10747903 time 0.330752
UNKNOWN: Tactic: 10944511 time 0.186784
UNKNOWN: Fastest Tactic: 4194303 Time: 0.179168
UNKNOWN: --------------- Timing Runner: conv4-2 (CaskConvolution)
UNKNOWN: conv4-2 (scudnn) Set Tactic Name: volta_scudnn_128x128_relu_interior_nn_v1
UNKNOWN: Tactic: 1754569683116234317 time 0.431328
UNKNOWN: conv4-2 (scudnn) Set Tactic Name: volta_scudnn_128x128_relu_medium_nn_v1
UNKNOWN: Tactic: 1825138533642645384 time 0.43216
UNKNOWN: conv4-2 (scudnn) Set Tactic Name: volta_scudnn_128x32_relu_interior_nn_v1
UNKNOWN: Tactic: 2733356012094739613 time 0.13312
UNKNOWN: conv4-2 (scudnn) Set Tactic Name: volta_scudnn_128x128_relu_small_nn_v1
UNKNOWN: Tactic: 3915320020053085238 time 0.441376
UNKNOWN: conv4-2 (scudnn) Set Tactic Name: volta_scudnn_128x64_relu_small_nn_v1
UNKNOWN: Tactic: 6808617066150061604 time 0.220896
UNKNOWN: conv4-2 (scudnn) Set Tactic Name: volta_scudnn_128x64_relu_interior_nn_v1
UNKNOWN: Tactic: 9091006216302412844 time 0.211456
UNKNOWN: conv4-2 (scudnn) Set Tactic Name: volta_scudnn_128x64_relu_medium_nn_v1
UNKNOWN: Tactic: -8060443123034038864 time 0.222208
UNKNOWN: conv4-2 (scudnn) Set Tactic Name: volta_scudnn_128x32_relu_medium_nn_v1
UNKNOWN: Tactic: -4420849921117327522 time 0.15664
UNKNOWN: conv4-2 (scudnn) Set Tactic Name: volta_scudnn_128x32_relu_small_nn_v1
UNKNOWN: Tactic: -3946921629105938337 time 0.135136
UNKNOWN: Fastest Tactic: 2733356012094739613 Time: 0.13312
UNKNOWN: --------------- Timing Runner: conv4-2 (CudaConvolution)
UNKNOWN: Tactic: 0 time 0.180096
UNKNOWN: Tactic: 2 time 0.312896
UNKNOWN: Tactic: 5 time 0.741312
UNKNOWN: Tactic: 57 time 0.180224
UNKNOWN: Fastest Tactic: 0 Time: 0.180096
UNKNOWN: --------------- Timing Runner: conv4-2 (CudaDepthwiseConvolution)
UNKNOWN: CudaDepthwiseConvolution has no valid tactics for this config, skipping
UNKNOWN: >>>>>>>>>>>>>>> Chose Runner Type: CaskConvolution Tactic: 2733356012094739613
UNKNOWN: conv4-2 (scudnn) Set Tactic Name: volta_scudnn_128x32_relu_interior_nn_v1
UNKNOWN: 
UNKNOWN: conv4-2 (scudnn) Set Tactic Name: volta_scudnn_128x128_relu_interior_nn_v1
UNKNOWN: conv4-2 (scudnn) Set Tactic Name: volta_scudnn_128x128_relu_medium_nn_v1
UNKNOWN: conv4-2 (scudnn) Set Tactic Name: volta_scudnn_128x32_relu_interior_nn_v1
UNKNOWN: conv4-2 (scudnn) Set Tactic Name: volta_scudnn_128x128_relu_small_nn_v1
UNKNOWN: conv4-2 (scudnn) Set Tactic Name: volta_scudnn_128x64_relu_small_nn_v1
UNKNOWN: conv4-2 (scudnn) Set Tactic Name: volta_scudnn_128x64_relu_interior_nn_v1
UNKNOWN: conv4-2 (scudnn) Set Tactic Name: volta_scudnn_128x64_relu_medium_nn_v1
UNKNOWN: conv4-2 (scudnn) Set Tactic Name: volta_scudnn_128x32_relu_medium_nn_v1
UNKNOWN: conv4-2 (scudnn) Set Tactic Name: volta_scudnn_128x32_relu_small_nn_v1
UNKNOWN: conv4-2 (scudnn) Set Tactic Name: volta_scudnn_128x32_relu_interior_nn_v1
UNKNOWN: *************** Autotuning format combination: Float(1,187,19261,616352) -> Float(1,187,19261,38522) ***************
UNKNOWN: conv4-1 (scudnn) Set Tactic Name: volta_scudnn_128x128_relu_interior_nn_v1
UNKNOWN: conv4-1 (scudnn) Set Tactic Name: volta_scudnn_128x128_relu_medium_nn_v1
UNKNOWN: conv4-1 (scudnn) Set Tactic Name: volta_scudnn_128x32_relu_interior_nn_v1
UNKNOWN: conv4-1 (scudnn) Set Tactic Name: volta_scudnn_128x128_relu_small_nn_v1
UNKNOWN: conv4-1 (scudnn) Set Tactic Name: volta_scudnn_128x64_relu_small_nn_v1
UNKNOWN: conv4-1 (scudnn) Set Tactic Name: volta_scudnn_128x64_relu_interior_nn_v1
UNKNOWN: conv4-1 (scudnn) Set Tactic Name: volta_scudnn_128x64_relu_medium_nn_v1
UNKNOWN: conv4-1 (scudnn) Set Tactic Name: volta_scudnn_128x32_relu_medium_nn_v1
UNKNOWN: conv4-1 (scudnn) Set Tactic Name: volta_scudnn_128x32_relu_small_nn_v1
UNKNOWN: --------------- Timing Runner: conv4-1 (FusedConvActConvolution)
UNKNOWN: Tactic: 589823 time 0.185536
UNKNOWN: Tactic: 786431 time 0.198656
UNKNOWN: Tactic: 1179647 time 0.451616
UNKNOWN: Tactic: 1310719 time 0.343712
UNKNOWN: Tactic: 1376255 time 0.288512
UNKNOWN: Tactic: 1441791 time 0.774272
UNKNOWN: Tactic: 1638399 time 0.263424
UNKNOWN: Tactic: 1835007 time 0.19552
UNKNOWN: Tactic: 2097151 time 0.358656
UNKNOWN: Tactic: 2162687 time 0.255968
UNKNOWN: Tactic: 2293759 time 0.272352
UNKNOWN: Tactic: 2359295 time 0.291872
UNKNOWN: Tactic: 2686975 time 0.250592
UNKNOWN: Tactic: 3407871 time 0.3016
UNKNOWN: Tactic: 3538943 time 0.33792
UNKNOWN: Tactic: 3997695 time 0.233472
UNKNOWN: Tactic: 4194303 time 0.1768
UNKNOWN: Tactic: 4259839 time 0.32768
UNKNOWN: Tactic: 4325375 time 0.20576
UNKNOWN: Tactic: 4521983 time 0.167904
UNKNOWN: Tactic: 4587519 time 0.199008
UNKNOWN: Tactic: 4653055 time 0.393248
UNKNOWN: Tactic: 4915199 time 0.197472
UNKNOWN: Tactic: 4980735 time 0.183584
UNKNOWN: Tactic: 5177343 time 0.458784
UNKNOWN: Tactic: 5242879 time 0.28864
UNKNOWN: Tactic: 5373951 time 0.523232
UNKNOWN: Tactic: 5439487 time 0.313312
UNKNOWN: Tactic: 5701631 time 0.253984
UNKNOWN: Tactic: 5767167 time 0.68096
UNKNOWN: Tactic: 5832703 time 0.301408
UNKNOWN: Tactic: 5898239 time 0.47312
UNKNOWN: Tactic: 6029311 time 0.26768
UNKNOWN: Tactic: 6225919 time 0.316416
UNKNOWN: Tactic: 6291455 time 0.450592
UNKNOWN: Tactic: 6750207 time 0.264736
UNKNOWN: Tactic: 6815743 time 0.344672
UNKNOWN: Tactic: 6946815 time 0.284672
UNKNOWN: Tactic: 7012351 time 0.358112
UNKNOWN: Tactic: 7077887 time 0.329408
UNKNOWN: Tactic: 7143423 time 0.27696
UNKNOWN: Tactic: 7208959 time 0.30032
UNKNOWN: Tactic: 7340031 time 0.472064
UNKNOWN: Tactic: 7405567 time 0.389408
UNKNOWN: Tactic: 7536639 time 0.333024
UNKNOWN: Tactic: 7602175 time 0.191488
UNKNOWN: Tactic: 7733247 time 0.33472
UNKNOWN: Tactic: 7798783 time 0.199936
UNKNOWN: Tactic: 8191999 time 0.272224
UNKNOWN: Tactic: 8257535 time 0.249856
UNKNOWN: Tactic: 8323071 time 0.222208
UNKNOWN: Tactic: 8650751 time 0.21264
UNKNOWN: Tactic: 8716287 time 0.385024
UNKNOWN: Tactic: 9109503 time 0.369696
UNKNOWN: Tactic: 9568255 time 0.197664
UNKNOWN: Tactic: 9895935 time 0.176032
UNKNOWN: Tactic: 10223615 time 0.251072
UNKNOWN: Tactic: 10354687 time 0.273856
UNKNOWN: Tactic: 10551295 time 0.187264
UNKNOWN: Tactic: 10747903 time 0.328544
UNKNOWN: Tactic: 10944511 time 0.18288
UNKNOWN: Fastest Tactic: 4521983 Time: 0.167904
UNKNOWN: --------------- Timing Runner: conv4-1 (CaskConvolution)
UNKNOWN: conv4-1 (scudnn) Set Tactic Name: volta_scudnn_128x128_relu_interior_nn_v1
UNKNOWN: Tactic: 1754569683116234317 time 0.432704
UNKNOWN: conv4-1 (scudnn) Set Tactic Name: volta_scudnn_128x128_relu_medium_nn_v1
UNKNOWN: Tactic: 1825138533642645384 time 0.432032
UNKNOWN: conv4-1 (scudnn) Set Tactic Name: volta_scudnn_128x32_relu_interior_nn_v1
UNKNOWN: Tactic: 2733356012094739613 time 0.130656
UNKNOWN: conv4-1 (scudnn) Set Tactic Name: volta_scudnn_128x128_relu_small_nn_v1
UNKNOWN: Tactic: 3915320020053085238 time 0.432128
UNKNOWN: conv4-1 (scudnn) Set Tactic Name: volta_scudnn_128x64_relu_small_nn_v1
UNKNOWN: Tactic: 6808617066150061604 time 0.218112
UNKNOWN: conv4-1 (scudnn) Set Tactic Name: volta_scudnn_128x64_relu_interior_nn_v1
UNKNOWN: Tactic: 9091006216302412844 time 0.214048
UNKNOWN: conv4-1 (scudnn) Set Tactic Name: volta_scudnn_128x64_relu_medium_nn_v1
UNKNOWN: Tactic: -8060443123034038864 time 0.222208
UNKNOWN: conv4-1 (scudnn) Set Tactic Name: volta_scudnn_128x32_relu_medium_nn_v1
UNKNOWN: Tactic: -4420849921117327522 time 0.154816
UNKNOWN: conv4-1 (scudnn) Set Tactic Name: volta_scudnn_128x32_relu_small_nn_v1
UNKNOWN: Tactic: -3946921629105938337 time 0.131296
UNKNOWN: Fastest Tactic: 2733356012094739613 Time: 0.130656
UNKNOWN: --------------- Timing Runner: conv4-1 (CudaConvolution)
UNKNOWN: Tactic: 0 time 0.168768
UNKNOWN: Tactic: 2 time 0.301024
UNKNOWN: Tactic: 5 time 0.679712
UNKNOWN: Tactic: 57 time 0.166944
UNKNOWN: Fastest Tactic: 57 Time: 0.166944
UNKNOWN: --------------- Timing Runner: conv4-1 (CudaDepthwiseConvolution)
UNKNOWN: CudaDepthwiseConvolution has no valid tactics for this config, skipping
UNKNOWN: >>>>>>>>>>>>>>> Chose Runner Type: CaskConvolution Tactic: 2733356012094739613
UNKNOWN: conv4-1 (scudnn) Set Tactic Name: volta_scudnn_128x32_relu_interior_nn_v1
UNKNOWN: 
UNKNOWN: conv4-1 (scudnn) Set Tactic Name: volta_scudnn_128x128_relu_interior_nn_v1
UNKNOWN: conv4-1 (scudnn) Set Tactic Name: volta_scudnn_128x128_relu_medium_nn_v1
UNKNOWN: conv4-1 (scudnn) Set Tactic Name: volta_scudnn_128x32_relu_interior_nn_v1
UNKNOWN: conv4-1 (scudnn) Set Tactic Name: volta_scudnn_128x128_relu_small_nn_v1
UNKNOWN: conv4-1 (scudnn) Set Tactic Name: volta_scudnn_128x64_relu_small_nn_v1
UNKNOWN: conv4-1 (scudnn) Set Tactic Name: volta_scudnn_128x64_relu_interior_nn_v1
UNKNOWN: conv4-1 (scudnn) Set Tactic Name: volta_scudnn_128x64_relu_medium_nn_v1
UNKNOWN: conv4-1 (scudnn) Set Tactic Name: volta_scudnn_128x32_relu_medium_nn_v1
UNKNOWN: conv4-1 (scudnn) Set Tactic Name: volta_scudnn_128x32_relu_small_nn_v1
UNKNOWN: conv4-1 (scudnn) Set Tactic Name: volta_scudnn_128x32_relu_interior_nn_v1
UNKNOWN: *************** Autotuning format combination: Float(1,187,19261,38522) -> Float(1,187,19261,38522) ***************
UNKNOWN: --------------- Timing Runner: prob1 (SoftMax)
UNKNOWN: Tactic: 1001 time 0.015712
UNKNOWN: Fastest Tactic: 1001 Time: 0.015712
UNKNOWN: --------------- Timing Runner: prob1 (ExtSoftMax)
UNKNOWN: ExtSoftMax has no valid tactics for this config, skipping
UNKNOWN: >>>>>>>>>>>>>>> Chose Runner Type: SoftMax Tactic: 1001
UNKNOWN: 
UNKNOWN: Formats and tactics selection completed in 17.0091 seconds.
UNKNOWN: After reformat layers: 16 layers
UNKNOWN: Block size 33554432
UNKNOWN: Block size 3270144
UNKNOWN: Block size 3270144
UNKNOWN: Block size 3270144
UNKNOWN: Total Activation Memory: 43364864
UNKNOWN: conv1 (scudnn) Set Tactic Name: volta_scudnn_128x32_relu_interior_nn_v1
UNKNOWN: conv2 (scudnn) Set Tactic Name: volta_scudnn_128x32_relu_medium_nn_v1
UNKNOWN: conv3 (scudnn_winograd) Set Tactic Name: volta_scudnn_winograd_128x128_ldg1_ldg4_relu_tile148t_nt_v1
UNKNOWN: conv4-2 (scudnn) Set Tactic Name: volta_scudnn_128x32_relu_interior_nn_v1
UNKNOWN: conv4-1 (scudnn) Set Tactic Name: volta_scudnn_128x32_relu_interior_nn_v1
UNKNOWN: Layer: conv1 Weights: 0 HostPersistent: 3200 DevicePersistent: 492032
UNKNOWN: Layer: scale1_1 + ReLU1_2 Weights: 0 HostPersistent: 0 DevicePersistent: 0
UNKNOWN: Layer: scale1_2 Weights: 0 HostPersistent: 0 DevicePersistent: 0
UNKNOWN: Layer: PWN(ReLU1, eltwise-sum1) Weights: 0 HostPersistent: 372 DevicePersistent: 0
UNKNOWN: Layer: pool1 Weights: 0 HostPersistent: 0 DevicePersistent: 0
UNKNOWN: Layer: conv2 Weights: 0 HostPersistent: 2176 DevicePersistent: 125440
UNKNOWN: Layer: scale2_1 + ReLU2_2 Weights: 0 HostPersistent: 0 DevicePersistent: 0
UNKNOWN: Layer: scale2_2 Weights: 0 HostPersistent: 0 DevicePersistent: 0
UNKNOWN: Layer: PWN(ReLU2, eltwise-sum2) Weights: 0 HostPersistent: 372 DevicePersistent: 0
UNKNOWN: Layer: conv3 Weights: 0 HostPersistent: 512 DevicePersistent: 51712
UNKNOWN: Layer: scale3_1 + ReLU3_2 Weights: 0 HostPersistent: 0 DevicePersistent: 0
UNKNOWN: Layer: scale3_2 Weights: 0 HostPersistent: 0 DevicePersistent: 0
UNKNOWN: Layer: PWN(ReLU3, eltwise-sum3) Weights: 0 HostPersistent: 372 DevicePersistent: 0
UNKNOWN: Layer: conv4-2 Weights: 0 HostPersistent: 3200 DevicePersistent: 116224
UNKNOWN: Layer: conv4-1 Weights: 0 HostPersistent: 3200 DevicePersistent: 116224
UNKNOWN: Layer: prob1 Weights: 0 HostPersistent: 0 DevicePersistent: 0
UNKNOWN: Total Host Persistent Memory: 13404
UNKNOWN: Total Device Persistent Memory: 901632
UNKNOWN: Total Weight Memory: 0
UNKNOWN: Builder timing cache: created 15 entries, 17 hit(s)
UNKNOWN: Engine generation completed in 17.0467 seconds.
UNKNOWN: Engine Layer Information:
UNKNOWN: Layer(scudnn): conv1, Tactic: 2733356012094739613, data[Float(3,216,384)] -> conv1[Float(10,214,382)]
UNKNOWN: Layer(Scale): scale1_1 + ReLU1_2, Tactic: 0, conv1[Float(10,214,382)] -> (Unnamed Layer* 3) [Activation]_output[Float(10,214,382)]
UNKNOWN: Layer(Scale): scale1_2, Tactic: 0, (Unnamed Layer* 3) [Activation]_output[Float(10,214,382)] -> conv1_2[Float(10,214,382)]
UNKNOWN: Layer(PointWiseV2): PWN(ReLU1, eltwise-sum1), Tactic: 0, conv1[Float(10,214,382)], conv1_2[Float(10,214,382)] -> conv1_3[Float(10,214,382)]
UNKNOWN: Layer(PoolingTiled): pool1, Tactic: 5636353, conv1_3[Float(10,214,382)] -> pool1[Float(10,107,191)]
UNKNOWN: Layer(scudnn): conv2, Tactic: -4420849921117327522, pool1[Float(10,107,191)] -> conv2[Float(16,105,189)]
UNKNOWN: Layer(Scale): scale2_1 + ReLU2_2, Tactic: 0, conv2[Float(16,105,189)] -> (Unnamed Layer* 10) [Activation]_output[Float(16,105,189)]
UNKNOWN: Layer(Scale): scale2_2, Tactic: 0, (Unnamed Layer* 10) [Activation]_output[Float(16,105,189)] -> conv2_2[Float(16,105,189)]
UNKNOWN: Layer(PointWiseV2): PWN(ReLU2, eltwise-sum2), Tactic: 8, conv2[Float(16,105,189)], conv2_2[Float(16,105,189)] -> conv2_3[Float(16,105,189)]
UNKNOWN: Layer(scudnn_winograd): conv3, Tactic: 2775507031594384867, conv2_3[Float(16,105,189)] -> conv3[Float(32,103,187)]
UNKNOWN: Layer(Scale): scale3_1 + ReLU3_2, Tactic: 0, conv3[Float(32,103,187)] -> (Unnamed Layer* 16) [Activation]_output[Float(32,103,187)]
UNKNOWN: Layer(Scale): scale3_2, Tactic: 0, (Unnamed Layer* 16) [Activation]_output[Float(32,103,187)] -> conv3_2[Float(32,103,187)]
UNKNOWN: Layer(PointWiseV2): PWN(ReLU3, eltwise-sum3), Tactic: 2, conv3[Float(32,103,187)], conv3_2[Float(32,103,187)] -> conv3_3[Float(32,103,187)]
UNKNOWN: Layer(scudnn): conv4-2, Tactic: 2733356012094739613, conv3_3[Float(32,103,187)] -> conv4-2[Float(4,103,187)]
UNKNOWN: Layer(scudnn): conv4-1, Tactic: 2733356012094739613, conv3_3[Float(32,103,187)] -> conv4-1[Float(2,103,187)]
UNKNOWN: Layer(SoftMax): prob1, Tactic: 1001, conv4-1[Float(2,103,187)] -> prob1[Float(2,103,187)]
UNKNOWN: Applying generic optimizations to the graph for inference.
UNKNOWN: Original: 22 layers
UNKNOWN: After dead-layer removal: 22 layers
UNKNOWN: After Myelin optimization: 22 layers
UNKNOWN: After scale fusion: 22 layers
UNKNOWN: Fusing scale1_1 with ReLU1_2
UNKNOWN: Fusing scale2_1 with ReLU2_2
UNKNOWN: Fusing scale3_1 with ReLU3_2
UNKNOWN: Fusing ReLU1 with eltwise-sum1
UNKNOWN: Fusing ReLU2 with eltwise-sum2
UNKNOWN: Fusing ReLU3 with eltwise-sum3
UNKNOWN: After vertical fusions: 16 layers
UNKNOWN: After final dead-layer removal: 16 layers
UNKNOWN: After tensor merging: 16 layers
UNKNOWN: After concat removal: 16 layers
UNKNOWN: Graph construction and optimization completed in 0.00625099 seconds.
UNKNOWN: Constructing optimization profile number 0 [1/1].
UNKNOWN: *************** Autotuning format combination: Float(1,273,42042,126126) -> Float(1,271,41192,411920) ***************
UNKNOWN: conv1 (scudnn) Set Tactic Name: volta_scudnn_128x128_relu_interior_nn_v1
UNKNOWN: conv1 (scudnn) Set Tactic Name: volta_scudnn_128x128_relu_medium_nn_v1
UNKNOWN: conv1 (scudnn) Set Tactic Name: volta_scudnn_128x32_relu_interior_nn_v1
UNKNOWN: conv1 (scudnn_winograd) Set Tactic Name: volta_scudnn_winograd_128x128_ldg1_ldg4_relu_tile148t_nt_v1
UNKNOWN: conv1 (scudnn) Set Tactic Name: volta_scudnn_128x64_relu_xregs_large_nn_v1
UNKNOWN: conv1 (scudnn) Set Tactic Name: volta_scudnn_128x128_relu_small_nn_v1
UNKNOWN: conv1 (scudnn) Set Tactic Name: volta_scudnn_128x128_relu_xregs_large_nn_v1
UNKNOWN: conv1 (scudnn) Set Tactic Name: volta_scudnn_128x64_relu_small_nn_v1
UNKNOWN: conv1 (scudnn) Set Tactic Name: volta_scudnn_128x64_relu_interior_nn_v1
UNKNOWN: conv1 (scudnn) Set Tactic Name: volta_scudnn_128x64_relu_medium_nn_v1
UNKNOWN: conv1 (scudnn) Set Tactic Name: volta_scudnn_128x32_relu_medium_nn_v1
UNKNOWN: conv1 (scudnn) Set Tactic Name: volta_scudnn_128x32_relu_small_nn_v1
UNKNOWN: --------------- Timing Runner: conv1 (FusedConvActConvolution)
UNKNOWN: Tactic: 524287 time 0.433024
UNKNOWN: Tactic: 1966079 time 0.4512
UNKNOWN: Tactic: 2031615 time 0.447424
UNKNOWN: Tactic: 4390911 time 0.475168
UNKNOWN: Tactic: 5963775 time 0.456576
UNKNOWN: Tactic: 6881279 time 0.466944
UNKNOWN: Tactic: 8585215 time 0.426016
UNKNOWN: Tactic: 8978431 time 0.437696
UNKNOWN: Tactic: 9502719 time 0.468128
UNKNOWN: Tactic: 10092543 time 0.46592
UNKNOWN: Tactic: 10289151 time 0.45152
UNKNOWN: Fastest Tactic: 8585215 Time: 0.426016
UNKNOWN: --------------- Timing Runner: conv1 (CaskConvolution)
UNKNOWN: conv1 (scudnn) Set Tactic Name: volta_scudnn_128x128_relu_interior_nn_v1
UNKNOWN: Tactic: 1754569683116234317 time 0.891744
UNKNOWN: conv1 (scudnn) Set Tactic Name: volta_scudnn_128x128_relu_medium_nn_v1
UNKNOWN: Tactic: 1825138533642645384 time 0.904192
UNKNOWN: conv1 (scudnn) Set Tactic Name: volta_scudnn_128x32_relu_interior_nn_v1
UNKNOWN: Tactic: 2733356012094739613 time 0.228384
UNKNOWN: conv1 (scudnn_winograd) Set Tactic Name: volta_scudnn_winograd_128x128_ldg1_ldg4_relu_tile148t_nt_v1
UNKNOWN: Tactic: 2775507031594384867 time 0.40768
UNKNOWN: conv1 (scudnn) Set Tactic Name: volta_scudnn_128x64_relu_xregs_large_nn_v1
UNKNOWN: Tactic: 2842488832350522458 time 0.499712
UNKNOWN: conv1 (scudnn) Set Tactic Name: volta_scudnn_128x128_relu_small_nn_v1
UNKNOWN: Tactic: 3915320020053085238 time 0.90112
UNKNOWN: conv1 (scudnn) Set Tactic Name: volta_scudnn_128x128_relu_xregs_large_nn_v1
UNKNOWN: Tactic: 6448355332020552203 time 1.32224
UNKNOWN: conv1 (scudnn) Set Tactic Name: volta_scudnn_128x64_relu_small_nn_v1
UNKNOWN: Tactic: 6808617066150061604 time 0.44256
UNKNOWN: conv1 (scudnn) Set Tactic Name: volta_scudnn_128x64_relu_interior_nn_v1
UNKNOWN: Tactic: 9091006216302412844 time 0.427808
UNKNOWN: conv1 (scudnn) Set Tactic Name: volta_scudnn_128x64_relu_medium_nn_v1
UNKNOWN: Tactic: -8060443123034038864 time 0.44864
UNKNOWN: conv1 (scudnn) Set Tactic Name: volta_scudnn_128x32_relu_medium_nn_v1
UNKNOWN: Tactic: -4420849921117327522 time 0.272192
UNKNOWN: conv1 (scudnn) Set Tactic Name: volta_scudnn_128x32_relu_small_nn_v1
UNKNOWN: Tactic: -3946921629105938337 time 0.231392
UNKNOWN: Fastest Tactic: 2733356012094739613 Time: 0.228384
UNKNOWN: --------------- Timing Runner: conv1 (CudaConvolution)
UNKNOWN: Tactic: 0 time 0.399616
UNKNOWN: Tactic: 2 time 0.804864
UNKNOWN: Tactic: 5 time 3.6416
UNKNOWN: Tactic: 6 time 0.494464
UNKNOWN: Tactic: 57 time 0.403424
UNKNOWN: Fastest Tactic: 0 Time: 0.399616
UNKNOWN: --------------- Timing Runner: conv1 (CudaDepthwiseConvolution)
UNKNOWN: CudaDepthwiseConvolution has no valid tactics for this config, skipping
UNKNOWN: >>>>>>>>>>>>>>> Chose Runner Type: CaskConvolution Tactic: 2733356012094739613
UNKNOWN: conv1 (scudnn) Set Tactic Name: volta_scudnn_128x32_relu_interior_nn_v1
UNKNOWN: 
UNKNOWN: conv1 (scudnn) Set Tactic Name: volta_scudnn_128x128_relu_interior_nn_v1
UNKNOWN: conv1 (scudnn) Set Tactic Name: volta_scudnn_128x128_relu_medium_nn_v1
UNKNOWN: conv1 (scudnn) Set Tactic Name: volta_scudnn_128x32_relu_interior_nn_v1
UNKNOWN: conv1 (scudnn_winograd) Set Tactic Name: volta_scudnn_winograd_128x128_ldg1_ldg4_relu_tile148t_nt_v1
UNKNOWN: conv1 (scudnn) Set Tactic Name: volta_scudnn_128x64_relu_xregs_large_nn_v1
UNKNOWN: conv1 (scudnn) Set Tactic Name: volta_scudnn_128x128_relu_small_nn_v1
UNKNOWN: conv1 (scudnn) Set Tactic Name: volta_scudnn_128x128_relu_xregs_large_nn_v1
UNKNOWN: conv1 (scudnn) Set Tactic Name: volta_scudnn_128x64_relu_small_nn_v1
UNKNOWN: conv1 (scudnn) Set Tactic Name: volta_scudnn_128x64_relu_interior_nn_v1
UNKNOWN: conv1 (scudnn) Set Tactic Name: volta_scudnn_128x64_relu_medium_nn_v1
UNKNOWN: conv1 (scudnn) Set Tactic Name: volta_scudnn_128x32_relu_medium_nn_v1
UNKNOWN: conv1 (scudnn) Set Tactic Name: volta_scudnn_128x32_relu_small_nn_v1
UNKNOWN: conv1 (scudnn) Set Tactic Name: volta_scudnn_128x32_relu_interior_nn_v1
UNKNOWN: --------------- Timing Runner: <reformat> (Reformat)
UNKNOWN: Tactic: 1002 time 0.517248
UNKNOWN: Tactic: 0 time 0.418656
UNKNOWN: Fastest Tactic: 0 Time: 0.418656
UNKNOWN: --------------- Timing Runner: <reformat> (Reformat)
UNKNOWN: Tactic: 1002 time 0.344192
UNKNOWN: Tactic: 0 time 0.338624
UNKNOWN: Fastest Tactic: 0 Time: 0.338624
UNKNOWN: *************** Autotuning format combination: Float(1,271,41192,411920) -> Float(1,271,41192,411920) ***************
UNKNOWN: --------------- Timing Runner: scale1_1 + ReLU1_2 (Scale)
UNKNOWN: Tactic: 0 is the only option, timing skipped
UNKNOWN: Fastest Tactic: 0 Time: 0
UNKNOWN: *************** Autotuning format combination: Float(1,271,41192,411920) -> Float(1,271,41192,411920) ***************
UNKNOWN: --------------- Timing Runner: scale1_2 (Scale)
UNKNOWN: Tactic: 0 is the only option, timing skipped
UNKNOWN: Fastest Tactic: 0 Time: 0
UNKNOWN: --------------- Timing Runner: <reformat> (Reformat)
UNKNOWN: Tactic: 1002 time 0.521216
UNKNOWN: Tactic: 0 time 0.417888
UNKNOWN: Fastest Tactic: 0 Time: 0.417888
UNKNOWN: *************** Autotuning format combination: Float(1,271,41192,411920), Float(1,271,41192,411920) -> Float(1,271,41192,411920) ***************
UNKNOWN: --------------- Timing Runner: PWN(ReLU1, eltwise-sum1) (PointWise)
UNKNOWN: Tactic: 128 time 0.1568
UNKNOWN: Tactic: 256 time 0.156768
UNKNOWN: Tactic: 512 time 0.157888
UNKNOWN: Tactic: -32 time 0.204064
UNKNOWN: Tactic: -64 time 0.186144
UNKNOWN: Tactic: -128 time 0.18208
UNKNOWN: Fastest Tactic: 256 Time: 0.156768
UNKNOWN: --------------- Timing Runner: PWN(ReLU1, eltwise-sum1) (PointWiseV2)
UNKNOWN: Tactic: 0 time 0.111648
UNKNOWN: Tactic: 1 time 0.112224
UNKNOWN: Tactic: 2 time 0.10736
UNKNOWN: Tactic: 3 time 0.109536
UNKNOWN: Tactic: 4 time 0.107104
UNKNOWN: Tactic: 5 time 0.10384
UNKNOWN: Tactic: 6 time 0.112896
UNKNOWN: Tactic: 7 time 0.106656
UNKNOWN: Tactic: 8 time 0.105824
UNKNOWN: Tactic: 9 time 0.106272
UNKNOWN: Tactic: 28 time 0.105472
UNKNOWN: Fastest Tactic: 5 Time: 0.10384
UNKNOWN: >>>>>>>>>>>>>>> Chose Runner Type: PointWiseV2 Tactic: 5
UNKNOWN: 
UNKNOWN: *************** Autotuning format combination: Float(1,271,41192:32,41192), Float(1,271,41192:32,41192) -> Float(1,271,41192:32,41192) ***************
UNKNOWN: --------------- Timing Runner: PWN(ReLU1, eltwise-sum1) (PointWise)
UNKNOWN: Tactic: 128 time 0.483296
UNKNOWN: Tactic: 256 time 0.484288
UNKNOWN: Tactic: 512 time 0.487264
UNKNOWN: Tactic: -32 time 0.589888
UNKNOWN: Tactic: -64 time 0.549888
UNKNOWN: Tactic: -128 time 0.55888
UNKNOWN: Fastest Tactic: 128 Time: 0.483296
UNKNOWN: --------------- Timing Runner: PWN(ReLU1, eltwise-sum1) (PointWiseV2)
UNKNOWN: Tactic: 24 time 0.563872
UNKNOWN: Tactic: 25 time 0.583712
UNKNOWN: Tactic: 26 time 0.592864
UNKNOWN: Tactic: 27 time 0.594944
UNKNOWN: Tactic: 31 time 0.569216
UNKNOWN: Fastest Tactic: 24 Time: 0.563872
UNKNOWN: >>>>>>>>>>>>>>> Chose Runner Type: PointWise Tactic: 128
UNKNOWN: 
UNKNOWN: *************** Autotuning format combination: Float(1,271,41192,411920) -> Float(1,136,10336,103360) ***************
UNKNOWN: --------------- Timing Runner: pool1 (Pooling)
UNKNOWN: Tactic: -1 time 0.141536
UNKNOWN: Fastest Tactic: -1 Time: 0.141536
UNKNOWN: --------------- Timing Runner: pool1 (TiledPooling)
UNKNOWN: Tactic: 5505281 time 0.08176
UNKNOWN: Tactic: 5570817 time 0.060256
UNKNOWN: Tactic: 5636353 time 0.058112
UNKNOWN: Tactic: 5701889 time 0.057504
UNKNOWN: Tactic: 5767425 time 0.056288
UNKNOWN: Tactic: 5832961 time 0.0576
UNKNOWN: Tactic: 5898497 time 0.057984
UNKNOWN: Tactic: 5964033 time 0.057472
UNKNOWN: Tactic: 6029569 time 0.072992
UNKNOWN: Tactic: 6095105 time 0.05632
UNKNOWN: Tactic: 6160641 time 0.055296
UNKNOWN: Tactic: 6226177 time 0.055296
UNKNOWN: Tactic: 6291713 time 0.054208
UNKNOWN: Tactic: 6357249 time 0.055392
UNKNOWN: Tactic: 6422785 time 0.055648
UNKNOWN: Tactic: 6488321 time 0.056288
UNKNOWN: Fastest Tactic: 6291713 Time: 0.054208
UNKNOWN: >>>>>>>>>>>>>>> Chose Runner Type: TiledPooling Tactic: 6291713
UNKNOWN: 
UNKNOWN: *************** Autotuning format combination: Float(1,136,10336,103360) -> Float(1,134,9916,158656) ***************
UNKNOWN: conv2 (scudnn) Set Tactic Name: volta_scudnn_128x128_relu_interior_nn_v1
UNKNOWN: conv2 (scudnn) Set Tactic Name: volta_scudnn_128x128_relu_medium_nn_v1
UNKNOWN: conv2 (scudnn) Set Tactic Name: volta_scudnn_128x32_relu_interior_nn_v1
UNKNOWN: conv2 (scudnn_winograd) Set Tactic Name: volta_scudnn_winograd_128x128_ldg1_ldg4_relu_tile148t_nt_v1
UNKNOWN: conv2 (scudnn) Set Tactic Name: volta_scudnn_128x64_relu_xregs_large_nn_v1
UNKNOWN: conv2 (scudnn) Set Tactic Name: volta_scudnn_128x128_relu_small_nn_v1
UNKNOWN: conv2 (scudnn) Set Tactic Name: volta_scudnn_128x128_relu_xregs_large_nn_v1
UNKNOWN: conv2 (scudnn) Set Tactic Name: volta_scudnn_128x64_relu_small_nn_v1
UNKNOWN: conv2 (scudnn) Set Tactic Name: volta_scudnn_128x64_relu_interior_nn_v1
UNKNOWN: conv2 (scudnn) Set Tactic Name: volta_scudnn_128x64_relu_medium_nn_v1
UNKNOWN: conv2 (scudnn) Set Tactic Name: volta_scudnn_128x32_relu_medium_nn_v1
UNKNOWN: conv2 (scudnn) Set Tactic Name: volta_scudnn_128x32_relu_small_nn_v1
UNKNOWN: --------------- Timing Runner: conv2 (FusedConvActConvolution)
UNKNOWN: Tactic: 524287 time 0.225056
UNKNOWN: Tactic: 720895 time 0.286656
UNKNOWN: Tactic: 1048575 time 0.194528
UNKNOWN: Tactic: 1966079 time 0.320448
UNKNOWN: Tactic: 2031615 time 0.316384
UNKNOWN: Tactic: 2752511 time 0.290816
UNKNOWN: Tactic: 2883583 time 0.538976
UNKNOWN: Tactic: 3473407 time 0.55888
UNKNOWN: Tactic: 3735551 time 0.512032
UNKNOWN: Tactic: 4390911 time 0.344352
UNKNOWN: Tactic: 5046271 time 0.196608
UNKNOWN: Tactic: 5963775 time 0.319232
UNKNOWN: Tactic: 6160383 time 0.227904
UNKNOWN: Tactic: 6488063 time 0.195296
UNKNOWN: Tactic: 6881279 time 0.310144
UNKNOWN: Tactic: 7995391 time 0.28192
UNKNOWN: Tactic: 8585215 time 0.231104
UNKNOWN: Tactic: 8978431 time 0.322592
UNKNOWN: Tactic: 9502719 time 0.328416
UNKNOWN: Tactic: 9830399 time 0.524288
UNKNOWN: Tactic: 10027007 time 0.18944
UNKNOWN: Tactic: 10092543 time 0.333792
UNKNOWN: Tactic: 10289151 time 0.319488
UNKNOWN: Fastest Tactic: 10027007 Time: 0.18944
UNKNOWN: --------------- Timing Runner: conv2 (CaskConvolution)
UNKNOWN: conv2 (scudnn) Set Tactic Name: volta_scudnn_128x128_relu_interior_nn_v1
UNKNOWN: Tactic: 1754569683116234317 time 0.527392
UNKNOWN: conv2 (scudnn) Set Tactic Name: volta_scudnn_128x128_relu_medium_nn_v1
UNKNOWN: Tactic: 1825138533642645384 time 0.527072
UNKNOWN: conv2 (scudnn) Set Tactic Name: volta_scudnn_128x32_relu_interior_nn_v1
UNKNOWN: Tactic: 2733356012094739613 time 0.154656
UNKNOWN: conv2 (scudnn_winograd) Set Tactic Name: volta_scudnn_winograd_128x128_ldg1_ldg4_relu_tile148t_nt_v1
UNKNOWN: Tactic: 2775507031594384867 time 0.170016
UNKNOWN: conv2 (scudnn) Set Tactic Name: volta_scudnn_128x64_relu_xregs_large_nn_v1
UNKNOWN: Tactic: 2842488832350522458 time 0.282976
UNKNOWN: conv2 (scudnn) Set Tactic Name: volta_scudnn_128x128_relu_small_nn_v1
UNKNOWN: Tactic: 3915320020053085238 time 0.52608
UNKNOWN: conv2 (scudnn) Set Tactic Name: volta_scudnn_128x128_relu_xregs_large_nn_v1
UNKNOWN: Tactic: 6448355332020552203 time 0.633824
UNKNOWN: conv2 (scudnn) Set Tactic Name: volta_scudnn_128x64_relu_small_nn_v1
UNKNOWN: Tactic: 6808617066150061604 time 0.2736
UNKNOWN: conv2 (scudnn) Set Tactic Name: volta_scudnn_128x64_relu_interior_nn_v1
UNKNOWN: Tactic: 9091006216302412844 time 0.262624
UNKNOWN: conv2 (scudnn) Set Tactic Name: volta_scudnn_128x64_relu_medium_nn_v1
UNKNOWN: Tactic: -8060443123034038864 time 0.27728
UNKNOWN: conv2 (scudnn) Set Tactic Name: volta_scudnn_128x32_relu_medium_nn_v1
UNKNOWN: Tactic: -4420849921117327522 time 0.164896
UNKNOWN: conv2 (scudnn) Set Tactic Name: volta_scudnn_128x32_relu_small_nn_v1
UNKNOWN: Tactic: -3946921629105938337 time 0.159616
UNKNOWN: Fastest Tactic: 2733356012094739613 Time: 0.154656
UNKNOWN: --------------- Timing Runner: conv2 (CudaConvolution)
UNKNOWN: Tactic: 0 time 0.23616
UNKNOWN: Tactic: 2 time 0.887808
UNKNOWN: Tactic: 5 time 1.56147
UNKNOWN: Tactic: 6 time 0.208512
UNKNOWN: Tactic: 57 time 0.234208
UNKNOWN: Fastest Tactic: 6 Time: 0.208512
UNKNOWN: --------------- Timing Runner: conv2 (CudaDepthwiseConvolution)
UNKNOWN: CudaDepthwiseConvolution has no valid tactics for this config, skipping
UNKNOWN: >>>>>>>>>>>>>>> Chose Runner Type: CaskConvolution Tactic: 2733356012094739613
UNKNOWN: conv2 (scudnn) Set Tactic Name: volta_scudnn_128x32_relu_interior_nn_v1
UNKNOWN: 
UNKNOWN: conv2 (scudnn) Set Tactic Name: volta_scudnn_128x128_relu_interior_nn_v1
UNKNOWN: conv2 (scudnn) Set Tactic Name: volta_scudnn_128x128_relu_medium_nn_v1
UNKNOWN: conv2 (scudnn) Set Tactic Name: volta_scudnn_128x32_relu_interior_nn_v1
UNKNOWN: conv2 (scudnn_winograd) Set Tactic Name: volta_scudnn_winograd_128x128_ldg1_ldg4_relu_tile148t_nt_v1
UNKNOWN: conv2 (scudnn) Set Tactic Name: volta_scudnn_128x64_relu_xregs_large_nn_v1
UNKNOWN: conv2 (scudnn) Set Tactic Name: volta_scudnn_128x128_relu_small_nn_v1
UNKNOWN: conv2 (scudnn) Set Tactic Name: volta_scudnn_128x128_relu_xregs_large_nn_v1
UNKNOWN: conv2 (scudnn) Set Tactic Name: volta_scudnn_128x64_relu_small_nn_v1
UNKNOWN: conv2 (scudnn) Set Tactic Name: volta_scudnn_128x64_relu_interior_nn_v1
UNKNOWN: conv2 (scudnn) Set Tactic Name: volta_scudnn_128x64_relu_medium_nn_v1
UNKNOWN: conv2 (scudnn) Set Tactic Name: volta_scudnn_128x32_relu_medium_nn_v1
UNKNOWN: conv2 (scudnn) Set Tactic Name: volta_scudnn_128x32_relu_small_nn_v1
UNKNOWN: conv2 (scudnn) Set Tactic Name: volta_scudnn_128x32_relu_interior_nn_v1
UNKNOWN: --------------- Timing Runner: <reformat> (Reformat)
UNKNOWN: Tactic: 1002 time 0.140288
UNKNOWN: Tactic: 0 time 0.167136
UNKNOWN: Fastest Tactic: 1002 Time: 0.140288
UNKNOWN: --------------- Timing Runner: <reformat> (Reformat)
UNKNOWN: Tactic: 1002 time 0.13824
UNKNOWN: Tactic: 0 time 0.13248
UNKNOWN: Fastest Tactic: 0 Time: 0.13248
UNKNOWN: *************** Autotuning format combination: Float(1,134,9916,158656) -> Float(1,134,9916,158656) ***************
UNKNOWN: --------------- Timing Runner: scale2_1 + ReLU2_2 (Scale)
UNKNOWN: Tactic: 0 is the only option, timing skipped
UNKNOWN: Fastest Tactic: 0 Time: 0
UNKNOWN: *************** Autotuning format combination: Float(1,134,9916,158656) -> Float(1,134,9916,158656) ***************
UNKNOWN: --------------- Timing Runner: scale2_2 (Scale)
UNKNOWN: Tactic: 0 is the only option, timing skipped
UNKNOWN: Fastest Tactic: 0 Time: 0
UNKNOWN: --------------- Timing Runner: <reformat> (Reformat)
UNKNOWN: Tactic: 1002 time 0.139488
UNKNOWN: Tactic: 0 time 0.167808
UNKNOWN: Fastest Tactic: 1002 Time: 0.139488
UNKNOWN: *************** Autotuning format combination: Float(1,134,9916,158656), Float(1,134,9916,158656) -> Float(1,134,9916,158656) ***************
UNKNOWN: --------------- Timing Runner: PWN(ReLU2, eltwise-sum2) (PointWise)
UNKNOWN: Tactic: 128 time 0.065536
UNKNOWN: Tactic: 256 time 0.066048
UNKNOWN: Tactic: 512 time 0.06832
UNKNOWN: Tactic: -32 time 0.094944
UNKNOWN: Tactic: -64 time 0.083136
UNKNOWN: Tactic: -128 time 0.079296
UNKNOWN: Fastest Tactic: 128 Time: 0.065536
UNKNOWN: --------------- Timing Runner: PWN(ReLU2, eltwise-sum2) (PointWiseV2)
UNKNOWN: Tactic: 0 time 0.04592
UNKNOWN: Tactic: 1 time 0.045696
UNKNOWN: Tactic: 2 time 0.04336
UNKNOWN: Tactic: 3 time 0.047136
UNKNOWN: Tactic: 4 time 0.045408
UNKNOWN: Tactic: 5 time 0.043552
UNKNOWN: Tactic: 6 time 0.047104
UNKNOWN: Tactic: 7 time 0.04528
UNKNOWN: Tactic: 8 time 0.044736
UNKNOWN: Tactic: 9 time 0.043936
UNKNOWN: Tactic: 28 time 0.043008
UNKNOWN: Fastest Tactic: 28 Time: 0.043008
UNKNOWN: >>>>>>>>>>>>>>> Chose Runner Type: PointWiseV2 Tactic: 28
UNKNOWN: 
UNKNOWN: *************** Autotuning format combination: Float(1,134,9916:32,9916), Float(1,134,9916:32,9916) -> Float(1,134,9916:32,9916) ***************
UNKNOWN: --------------- Timing Runner: PWN(ReLU2, eltwise-sum2) (PointWise)
UNKNOWN: Tactic: 128 time 0.12112
UNKNOWN: Tactic: 256 time 0.123136
UNKNOWN: Tactic: 512 time 0.124288
UNKNOWN: Tactic: -32 time 0.152992
UNKNOWN: Tactic: -64 time 0.147872
UNKNOWN: Tactic: -128 time 0.165856
UNKNOWN: Fastest Tactic: 128 Time: 0.12112
UNKNOWN: --------------- Timing Runner: PWN(ReLU2, eltwise-sum2) (PointWiseV2)
UNKNOWN: Tactic: 24 time 0.139008
UNKNOWN: Tactic: 25 time 0.145984
UNKNOWN: Tactic: 26 time 0.148448
UNKNOWN: Tactic: 27 time 0.147456
UNKNOWN: Tactic: 31 time 0.13824
UNKNOWN: Fastest Tactic: 31 Time: 0.13824
UNKNOWN: >>>>>>>>>>>>>>> Chose Runner Type: PointWise Tactic: 128
UNKNOWN: 
UNKNOWN: *************** Autotuning format combination: Float(1,134,9916,158656) -> Float(1,132,9504,304128) ***************
UNKNOWN: conv3 (scudnn) Set Tactic Name: volta_scudnn_128x128_relu_interior_nn_v1
UNKNOWN: conv3 (scudnn) Set Tactic Name: volta_scudnn_128x128_relu_medium_nn_v1
UNKNOWN: conv3 (scudnn) Set Tactic Name: volta_scudnn_128x32_relu_interior_nn_v1
UNKNOWN: conv3 (scudnn_winograd) Set Tactic Name: volta_scudnn_winograd_128x128_ldg1_ldg4_relu_tile148t_nt_v1
UNKNOWN: conv3 (scudnn) Set Tactic Name: volta_scudnn_128x64_relu_xregs_large_nn_v1
UNKNOWN: conv3 (scudnn) Set Tactic Name: volta_scudnn_128x128_relu_small_nn_v1
UNKNOWN: conv3 (scudnn) Set Tactic Name: volta_scudnn_128x128_relu_xregs_large_nn_v1
UNKNOWN: conv3 (scudnn) Set Tactic Name: volta_scudnn_128x64_relu_small_nn_v1
UNKNOWN: conv3 (scudnn) Set Tactic Name: volta_scudnn_128x64_relu_interior_nn_v1
UNKNOWN: conv3 (scudnn) Set Tactic Name: volta_scudnn_128x64_relu_medium_nn_v1
UNKNOWN: conv3 (scudnn) Set Tactic Name: volta_scudnn_128x32_relu_medium_nn_v1
UNKNOWN: conv3 (scudnn) Set Tactic Name: volta_scudnn_128x32_relu_small_nn_v1
UNKNOWN: --------------- Timing Runner: conv3 (FusedConvActConvolution)
UNKNOWN: Tactic: 524287 time 0.457696
UNKNOWN: Tactic: 720895 time 0.44928
UNKNOWN: Tactic: 983039 time 0.432192
UNKNOWN: Tactic: 1048575 time 0.388416
UNKNOWN: Tactic: 1703935 time 0.394208
UNKNOWN: Tactic: 1769471 time 0.777472
UNKNOWN: Tactic: 1966079 time 0.601024
UNKNOWN: Tactic: 2031615 time 0.58672
UNKNOWN: Tactic: 2228223 time 0.388096
UNKNOWN: Tactic: 2424831 time 0.418848
UNKNOWN: Tactic: 2621439 time 0.436224
UNKNOWN: Tactic: 2752511 time 0.4608
UNKNOWN: Tactic: 2818047 time 0.892064
UNKNOWN: Tactic: 2883583 time 0.870048
UNKNOWN: Tactic: 3014655 time 0.38256
UNKNOWN: Tactic: 3145727 time 0.436224
UNKNOWN: Tactic: 3473407 time 0.792544
UNKNOWN: Tactic: 3604479 time 0.386208
UNKNOWN: Tactic: 3735551 time 0.773024
UNKNOWN: Tactic: 4390911 time 0.60096
UNKNOWN: Tactic: 5046271 time 0.400416
UNKNOWN: Tactic: 5963775 time 0.568288
UNKNOWN: Tactic: 6160383 time 0.434144
UNKNOWN: Tactic: 6488063 time 0.395328
UNKNOWN: Tactic: 6881279 time 0.595968
UNKNOWN: Tactic: 7274495 time 0.551328
UNKNOWN: Tactic: 7864319 time 0.415392
UNKNOWN: Tactic: 7995391 time 0.443296
UNKNOWN: Tactic: 8585215 time 0.463712
UNKNOWN: Tactic: 8847359 time 0.606592
UNKNOWN: Tactic: 8978431 time 0.598272
UNKNOWN: Tactic: 9043967 time 0.394016
UNKNOWN: Tactic: 9175039 time 0.384192
UNKNOWN: Tactic: 9502719 time 0.605248
UNKNOWN: Tactic: 9830399 time 0.759104
UNKNOWN: Tactic: 9961471 time 0.538656
UNKNOWN: Tactic: 10027007 time 0.394048
UNKNOWN: Tactic: 10092543 time 0.617248
